{
  "schema_version": 1,
  "inputs": {
    "schema_version": 6,
    "batch": [
      {
        "run": "r7Kq2",
        "inputs": {
          "program": {
            "file": "in/k3v9QpZt/program"
          },
          "stdin": {
            "file": "cache/Wq81mN0x/f2Lp6sTa"
          },
          "time_limit": 2,
          "memory_limit": 256
        }
      },
      {
        "run": "r7Kq3",
        "inputs": {
          "program": {
            "file": "in/k3v9QpZt/program"
          },
          "stdin": {
            "file": "cache/c0Rj5yHe/u8Dn3wKb"
          },
          "files": {
            "files": {
              "grid.txt": {
                "file": "cache/c0Rj5yHe/grid.txt"
              }
            }
          },
          "time_limit": 2,
          "memory_limit": 256
        }
      }
    ]
  },
  "files": [
    {
      "path": "in/k3v9QpZt/program",
      "url": "http://proxy/unicon-results/results/0199a2c1-6b7e-7c3a-9f10-5d2e4b8a6c31/steps/compile/out/program?X-Amz-Algorithm=AWS4-HMAC-SHA256&X-Amz-Expires=900&X-Amz-Signature=example",
      "sha256": "4f1c2b7e9a0d3c6f8e5b1a2d4c7f9e0b3a6d8c1f2e4b7a9d0c3f6e8b1a5d2c4f",
      "size": 912384
    },
    {
      "path": "cache/Wq81mN0x/f2Lp6sTa",
      "url": "http://proxy/forgejo-lfs/lfs/9b/2e/4d71c0a8f3b6e2d9c4a1f7b0e3d6c9a2f5b8e1d4c7a0f3b6e9d2c5a8f1b4?X-Amz-Algorithm=AWS4-HMAC-SHA256&X-Amz-Expires=900&X-Amz-Signature=example",
      "sha256": "9b2e4d71c0a8f3b6e2d9c4a1f7b0e3d6c9a2f5b8e1d4c7a0f3b6e9d2c5a8f1b4",
      "size": 1048576,
      "cached": true
    },
    {
      "path": "cache/c0Rj5yHe/u8Dn3wKb",
      "url": "http://proxy/forgejo-lfs/lfs/1a/7c/3e9b5d2f8a1c4e7b0d3f6a9c2e5b8d1f4a7c0e3b6d9f2a5c8e1b4d7a0c3f?X-Amz-Algorithm=AWS4-HMAC-SHA256&X-Amz-Expires=900&X-Amz-Signature=example",
      "sha256": "1a7c3e9b5d2f8a1c4e7b0d3f6a9c2e5b8d1f4a7c0e3b6d9f2a5c8e1b4d7a0c3f",
      "size": 2048,
      "cached": true
    },
    {
      "path": "cache/c0Rj5yHe/grid.txt",
      "url": "http://proxy/api/v1/gradings/0199a2c1-6b7e-7c3a-9f10-5d2e4b8a6c31/steps/solution/files/grid.txt",
      "sha256": "c4e7b0d3f6a9c2e5b8d1f4a7c0e3b6d9f2a5c8e1b4d7a0c3f6e9b1a7c3e9b5d2",
      "size": 64,
      "cached": true
    }
  ],
  "uploads": "http://proxy/api/v1/gradings/0199a2c1-6b7e-7c3a-9f10-5d2e4b8a6c31/steps/solution/uploads",
  "done": "http://proxy/api/v1/gradings/0199a2c1-6b7e-7c3a-9f10-5d2e4b8a6c31/steps/solution/done",
  "time_limit": 16,
  "box_users": {
    "first": 20480,
    "last": 20487
  },
  "step_memory_mb": 400,
  "fail_on_non_accepted": false
}
